18850892	Is there such a thing as a &quot;Non-Functional Use Case&quot;?	I'm reading a System Requirements Document that was produced using Sparx Enterprise Architect. All requirements are mapped to particular Use Cases.  A few of the non-functional requirements for 'high availability' are mapped to a Use Case called 'Provide High Availability', marked as &lt;&lt;non-functional&gt;&gt;. Am fairly new to all this and struggling to decide if it makes sense for a Use Case be non-functional - hence the question.  If the answer is yes then great - but if not, I'd be interested to know people's opinions on how such requirements should map to Use Cases (if at all). 	TRUE
2955610	Are UI choices functional or non-functional requirements?	Today we had a discussion at the office about UI elements in the required document.  The question is whether a UI requirement is functional or non-functional.   'the background must be blue'   Is this a functional or non-functional requirement? 	TRUE
3492948	What are functional and non functional parts of an application?	I was asked this question in an interview.  What are functional and non functional parts of an application ? 	TRUE
4425121	Would this be correct functional and non-functional requirements?	Hi im insure about functional and non functional requirements, are these correct ?   FUNCTIONAL:  Player Creates account.  Player Chooses Region.  Player Chooses Player type.  Player TypeA/Player Typeb Views Game statistics.  Player TypeA Views opponent List.  Player TypeA/Player Typeb Selects Target/Assassin From Job List.  Player TypeA/Player Typeb Views opponent Map.  Player TypeA views weapons.  Player TypeA equips weapon .  Player TypeA Shoots weapon; compute hit probability.  Combat opponents player is hit; opponent eliminated Player TypeA receives points.  Player TypeA/Player Typeb sends message.  Player Typeb views target history.  This program requires a gps connection is this a functional requirement ?  Non-Functional:  ?????  Thanks in advance 	TRUE
4447659	Are these non-functional requirements correct?	Non-functional Requirements:   User has access to the internet User has GPS Create account information has valid characters. Communication: Create account: user receives UserID in return from server Communication: Application receives GPS information from server Communication: Application sends GPS information to server Communication: Server updates requested by user user score Communication: Server returns available jobs requested by user System shows available weapons User eliminates target within time-lock System communicates player to player messages   	TRUE
5056657	How to convert concurrent users into hits per second?	SRS for the system I'm currently working on includes the following non-functional requirement: 'the SuD shall be scalable to 200 concurrent users'. How can I convert this statement to a more measurable characteristic: 'hits per second'? 	
15781018	Non-functional requirement reliability measurement?	What is the measurement of the application's reliability as a non-functional requirement?  	TRUE
22166515	Why Browser compatibility testing comes in NFR?	I am making a SRS and as per the research that I have done on Non Functional Requirements 'Browser compatibility' testing comes in NFR . Please explain why we take 'Browser compatibility' in NFR 	
27823106	Max version of Cordova on xcode 4.5	Hi i being asked to develop a Phonegap / Cordova app. I have mac mini2,1 mid 2007 processor 1.83 Ghz intel C2D Memory 2 GB with OSX Lion 10.7.5. what max CLI version of Cordova i can install? i have tried to install Cordova 4.0 its says min xcode 4.6 is required. and can i upgrade xcode 4.5 to 4.6. do i have to upgrade Mac osx using this hardware? 	
27616525	Are these requirements correct (variable relations)	There is this example in a book, reading:     The   system shall allow posting of envelopes where the longest side (l) is   longer than or equal to 12 centimeters, but not longer than 75   centimeters. The smallest side (w) must be longer than or equal to 1   centimeter. The length must be twice the width and must be greater   than or equal to 10 centimeters. Measures are always rounded up to the   nearest centimeter. We can rewrite this requirement to read:    length >= 12 length &lt; 75 width >= 1 length – 2 x width >= 10   I do not understand how the last requirement (...l>=10) can coexist with the first requirement (l>=12)  Am I missing something here? 	TRUE
2514881	Establishing project requirements - anyone had any eureka moments?	I repeatedly find that establishing user requirements is one of the hardest parts of my job. This is for several reasons, for example, lack of shared technical vocabulary, incomplete understanding of domain on my part, inability of user to 'imagine' completed UI / product, etc etc.  Since this appears to be an ongoing challenge for me, has anyone here had a 'eureka' moment that has really helped them with this part of developing? For example, I have heard of the book 'Domain Driven Design', but not read it yet. Has anyone found a book, online resource of piece of advice that has really turned things around for them? 	TRUE
27539161	Why do some websites/applications require that passwords must begin with a letter?	Some number of websites/applications require that a password must begin with a letter, I find this plain stupid. It's pretty annoying... and the password entropy (security) is greatly reduced. So my question is... Is there a reason why some developers would choose this?   The only reasons I could think of are:   They are sheep (Seen it required somewhere else and just copied the trend) Some just implement it because that's the little regex they know Just to create a false sense of security for their clients   (Asking because I'm developing an app to manage user passwords and thinking to alert the users that if the website asks for that, they should not trust their security) 	
27358301	Hoster requirements for running Solr	I am planning to add a full-text search engine for searching a MySQL database to a website. Most recommendations on a nice, user-friendly implementation I found, mentioned the use of Apache Solr.  Keeping this in mind I started searching for the requirements for a hoster to use Solr but I didn't find any useful information expect for 'it should support java'. So I picked a random host that states it has Java JRE installed (http://wiki.dreamhost.com/What_We_Support) and asked if they supported Solr. Unfortunately, the answer was 'no'.  So, what would I need to be looking for? Do I need a dedicated server, a VPN, or are there shared hosting solutions where it is possible to run Solr?  What are the system requirements?  I hope there is someone out there, who knows a bit about this. Thanks! 	
23886880	Get a list of all requirements from Composer	We use composer to install 3rd party libraries. Dependencies can have their own requirements (other libraries, but also enabled extensions). When we use Composer to install dependencies on the server, it displays errors that particular extensions are not enabled.  Is it possible to get list of requirements in advance? Like a list of extensions that need to be enabled for the given project. 	
1061784	How can I learn about writing project specs?	I recently read through Code Complete, and it recommends that I create a project specification before actually coding.  The book didn't go very far into detail about what 'specs' are, and how they are made. Because this is a crucial part of software development, I would like to know how to create quality specs that are not too exhaustive.  Where can I learn more about software specifications? Or any of the other prerequisites outlined in Code Complete? 	TRUE
2719451	Software Requirement Specifications for Web Applications	I'm looking for some guidance/books to read when it comes to creating a software requirement specification for a web application. For inspiration I have read some spec documents for desktop based applications. The documents I have read capture a systems functional requirements in use cases which tend to be rather data oriented with use cases centered around the various CRUD operations the application is intended to perform.  I like this structure however I'm finding it rather difficult to marry it to what my web application needs to do, mostly reading data as opposed to manipulating it. I've had a go at writing some use cases however they all tend to boil down to 'Search for item', 'Change view of search results' or 'User selects facet to refine search results'. This doesn't sound quite right to me and makes me wonder if I'm going about this the right way.  Are there planning differences between web based and desktop based applications?  	TRUE
378856	User stories vs use cases	Are use cases just multiple user stories??  What are the benefits of using user stories over use cases.. and vice-versa... When to use one over other...  Does all agile methodologies uses user stories?? 	TRUE
23628597	Visual Studio 2013 Update 2: Global Apps e Android/iOS App	I have installed Update 2 for Visual Studio 2013, but in the project list I don't say as create project for iOS/Android with Cordova. Operating system used are Windows 7 Ultimate.  	
20219903	getting the balance right between SBEs and other product documentation	Reading online material (e.g. Fowler, Gerard), it seems that Specification By Example stories should not be complete specifications of functionality.  Question 1: How does one starting off with SBE's decide how comprehensive their stories need to be in terms of describing all of the functionality of a system?  I.e. when can I stop writing stories because I have captured enough?  Question 2: In an organisation where test teams verify products against the product documentation, if the stores are not a complete specification, am I correct in thinking that 'other' product documentation needs to contain all the cases that are not covered by the SBE's? 	
26471820	Simple Requirements Management	Looking for a vary simple way to manage requirements using text editor, the following is desird:   Can be easily edited by developers, readable in text Can be converted to PDF document for managers revisions can be tracked on git it can be broken up into chapters and sections Images can be added to requirement document. Paragraphs introducing the chapter can be added.   I tried LaTeX, its just not working, too many rules, too complex.  So each Requirement has 6 fields.   Requirement Number (1 to 4 digit integer) Depends on (Line above) Requirement Name Class (4 to 10 chars) Priority (required or optional) Requirement string   So I have tried to do the following which works ok in markdown  Req  | Belongs |    Name         | Class | Priority -----|---------|-----------------|-------|--------- 1209 | 1208    | File Delimiters | sysrs | required  Each file is enclosed in curly braces ``{}''. ____   But i do not like to always having to adjust the spacing in 'name field' when the name length changes.  So I tried the following:  --- ** 1209 ** &gt;&gt;&gt; 1208, File Delimiters, sysrs, required  Each file is enclosed in curly braces ``{}''. ___   But it is little hard to read.  So I would love to make it like this:  -------------------------------------------------------------------------------- | 1209 | File Delimiters | 1208 | sysrs | required -------------------------------------------------------------------------------- Each file is enclosed in curly braces ``{}''. --------------------------------------------------------------------------------   but markdown turns both of the lines into titles.  Would anyone have any recommendations?  Would like to avoid writing scripts to change the format.  Thanks... 	
14392050	What defines a real-time/near-real time system?	Is there a specific metric which a system should meet to be considered/classified as real-time web application or a near- real time web application?  When I see a non-functional requirement for a system on which I am working which states the solution shall return data in real time/near real time.  I understand the definition of the terms (as found http://en.wikipedia.org/wiki/Near_real-time), but I was wondering if there were standards like one might find for an application UI (example: Gnome recommendations http://developer.gnome.org/hig-book/3.5/feedback-response-times.html.en) for expectations of near real time in a web application.  This is a variant of another question: Define realtime on the web for business 	
26431533	How to import legacy requirement IDs into TFS 2013?	I am trying to import some existing requirements into TFS 2013 (currently just maintained in a Word doc). However, I need to preserve the existing, pre-assigned requirement IDs (for tracking against existing test cases outside of TFS, etc.). I've come up with multiple ways of doing it:   Keep it as part of the requirement title Add it to the description for the requirement Add a tag with the legacy req id to the appropriate req in TFS Add a new field for it to the requirement template (or simply use an existing unused field)   All of these seem pretty unclean to me except the 'new field' option, but I'd rather avoid changing the work item template if I could.  Are there are other/better ways to do this? Has anybody done something similar before? 	
7433499	Definitions for CMMI Requirement Types in TFS2010	I've recently been informed that I need to define the requirements for the project I'm working on using TFS and CMMI. Upon writing a new requirement, you must supply a 'Requirement Type'. My question is, where can I find actual definitions of the different requirement types? Yes, of course I have googled this already and have found some glossaries that are closely aligned, but not perfect.  If any of you out there have experience with CMMI, and can define these types or point to a better source of information, I would be greatly thankful.  To make this easier, the CMMI requirement types are listed (in TFS) as:   Business Objective Feature Functional Interface Operational Quality of Service Safety Scenario Security  	TRUE
849840	Using a Wiki for Requirements Management?	I have been looking for a collaborative tool for developing functional specifications. I am looking for the ability to:    Have multiple users contribute to the specification. Provide some form of traceability, which could be done manually if needed.  Provide users with the ability to add comments and notes.    Upload and display Visio documents  Upload and display mockup screens using Balsamiq Mockup.   My initial impression is that using a wiki could be a good tool for this task. Does anyone have experience with using a wiki for creating functional specifications?  What would be the pros and cons to using a tool like this as opposed to a requirements management tool?  Your input is greatly appreciated!  	
26033775	Change Prestashop 1.5.6.2 customer password requirements	I'm looking for a way to make some requirements on the customer registration form on Prestashop 1.5.6.2, so that the password should be at least six characters long and contain at least one capital letter.  The first thing with at least six characters is done, but need to configure the requirement of at least one capital letter in the password. Does anyone know how to do so?  Older customers should still be able to login with their old password.  Thanks. 	
21161666	How can be estimated maximum system usage?	We have web service connected to REST API a we need to estimate maximum usage for specifying HW requirements.   Inputs - We know estimated number of users and we know number of requests that we're able to process on one server instance per some time unit. Required output - number of server instances needed to process all requests, including unexpected peaks.  Problem we are facing - there can be usage peaks during hours and not all customers will make the same number of requests per some time unit etc.   How can be modeled such problem? Is there some technique or we can only estimate the final usage? 	
24307347	Software requirements analysis - Correctness of requirements	I'm just reading a book about Software Engeneering Design (book on amazon). I can not understand an example of correct and incorrect requirement, described in the book.  The book says:   the incorrect requirement is:     The software shall require users to log on using a unique combination of user ID and password.  the correct requirement is:     The software shall require users to log on using a user ID and password. The software shall require users to log on using a valide-mail address.    To illustrate the problem of requirements correctness, the book presents the example:     Example is based on requirements for a computer security system for which it requires users to log on using a unique combination of user ID and password.      In this case, when users attempt to log on using already existing user name or password, the system is required to reject the attempt, therefore giving insight into someone else's logon information.   How it is possible to give insight into user's logon information? What information can be obtained from the rejection of log on?  	TRUE
10622048	Routes in Symfony2	In some symfony2 project I have next definition of routes:  MyBundle_Default:     resource: 'routing/default.yml'     prefix: /{slug}-{resource_id}     requirements:         slug: '[a-z\-]+'         resource_id: '\d+'   But this requirements don't work.  For example, if I have '-' in slug (e.g. 'test-route') url like /test-route-9 do not work.  Is this a bug? 	
24959103	How to use the REQUIRES parameter in a MODULE creation - angularjs	The syntax for usage of a module is:  angular.module(name, [requires], [configFn]);   The Type for the [requires] parameter is:  !Array.&lt;string&gt;=   I have no idea what that means.  What does the exclamation point signify, that it's NOT an Array?  Why is there an equal sign at the end?  What is the period for?  Looking at another Stackoverflow question, the [requires] parameter is used to list other modules that this module uses.  So, is this sort of like an Include statement, that puts another module inside of this module? 	
4028786	MSF Agile: Risk vs Story Points?	I'm working through the creation of an initial set of user stories for a new project, and I'm using MSF Agile for the first time. I've got about 100 user stories, and I've assigned them all to areas and iterations, but the next step for me is assigning all of their Risk, Story Points, and Stack Rank values. However, I find that I'm assigning nearly mirror opposite values for risk and story points, i.e. all me 1-High risk stories are 3 story points, and all my 3-Low risk stories are 1 story points.   The MSDN documentation defines these fields as such:  'Story Points: A subjective unit of measure that captures the size of a user story. If you assign more points to a user story, you indicate that more work is required to implement it.'  'Risk: A subjective rating of the relative uncertainty around the successful completion of the user story. You can specify the following values: 1 - High, 2 - Medium, 3 - Low'  I find that these go hand in hard for pretty much every situation I've come across. In your experience, what are some examples of high risk stories worth only few story points, or low risk stories worth many points?   I need help in reasoning about these differently. How should I be thinking about these? 	TRUE
24531488	Cakephp 2.5.2 installation requirements	It may be unusual to ask for requirements as it's common to find this kind of information on the developers pages. But in this case I'm in doubt if there can be 'undefined' requirements.  Let's see what I've got.  I prepared a complete setup including the DebugKit as you can see on the first image.  Then, totally in accordance with the manuals, i prepared 2 tables, and 'baked all'.  The second image shows a screenshot of the output of the users/index.ctp on my local machine and on another server where everything runs normal.  But, after uploading this to the server where I expect to host the site I got lots of errors and undefined index messages. See the output on the third image.    I have to mention that the server works with PHP 5.3.28 and pdo_enabled and that I've copied all files to the /public_html folder so that there are no special rooting requirements.  So my questions: Are there other requirements to have cakephp 2.5.2 running? What can cause the malfunction?   Many thanks for any hint  first image http://cakephp252.96.lt/img/cwdinstallconfirm.png  second image http://cakephp252.96.lt/img/cupusers.png  failure http://cakephp252.96.lt/img/cwdusers.png 	
24203796	Oracle VM Virtualbox requirements?	I'm new to this site. I have a question about Oracle VM VirtualBox.  Having looked through the documentation I can't find the minimum requirements, would anyone happen to know what it requires?  I'm trying to use my windows 7 work PC and my boss wants to know if we need more RAM. 	
24179384	Sylius DisplayAction Requirements	i need for Sylius displayAction a requirement like that:  foo_display:     pattern: /{slug}/{stepName}     defaults: { _controller: sylius.controller.process:displayAction, scenarioAlias: 'foo_ordering', _menu_item: foo_order }     requirements:         slug: micropage|standard   But this not work for me. It will be exit with the follow exception:  The 'foo_display' route has some missing mandatory parameters ('slug').   500 Internal Server Error - MissingMandatoryParametersException  How i can fix this? I don't want to add the same route for 'standard'. I will use one for two ;) 	
23971599	What is wrong with this usecase diagram with respect to includes and extends	    Are the included and extending use cases make sense? 	TRUE
3061531	How to modify CSS when requirements change?	Suppose I'm given the requirement to generate a few pages that have tables on them. The original requirement is for all tables to be 500px.  I'd write my CSS as follows:  table {     width: 500px; }   That will apply across the board for all tables. Now, what if they change the requirement so that some tables are 600px. What's the best way to modify the CSS? Should I give the tables classes so  table.SizeOne {     width: 500px; }  table.SizeTwo {     width: 600px; }   Or is there a better way for me to deal with changes like this? 	
23805681	UML use case diagram server as system actor and which kind of use cases	I´m creating an use case diagram based on the following scenario:  There is a mobile application which passes data to an webserver/database. The webserver on the other hand sends data to the mobile application.   So i have two questions:   Data send to the application is individual data only for this smartphone/user. So does it make sense to show server/database as an external system actor which gets connected with the specific use cases? Are use cases (for the mobile app) like 'showing information about something' oder 'refresh data' necessary? Because i think they are not necessary for the business logic. What do you think?   Thanks for ideas! 	TRUE
4832029	Tool to track requirements and assumptions	I am leading a fairly massive project right now that is in it's idea phase (just getting off the ground) that has more questions than answers today.  With all of the uncertainty, our standard methodology for tracking requirements and gathering estimates won't cut it.  However, I still have to build a model and get the data that management needs for corporate accounting and budgeting purposes.    I've been asked to simply document the assumptions we're making as a project team and that the developers and application owners would be able to provide a very high level estimate for the work as needed by the business for budgeting purposes...  I need a tool that will also allow assumptions to be tied to high level requirements in a 1 to many relationship so that any changes to an assumption will allow us to identify where more estimation work is required.  Example...  Assumption: We will operate with a single facility responsible for x, y, and z.    Requirement/Scope:  - This system will need to have an additional facility added.  - This other system will need to be capable of processing x, y, and z.  So at the end of the day, if my assumption changes I want to quickly see that I have at least an impact to 2 of my requirements/scope lines... 	
3498070	Changing project requirements - should client pay	Not sure where to put this but a site filled with working programmers is a good bet.  I built a website for a client, that included (on the home page) a fancy jQuery image slider with controls. This was specified in the original project scope. I also implemented a simple jQuery slider on one of the inner pages.  Now that the site is up for final review, the client reviewed the site and wants a few edits here and there, one being the removal of the fancy jQuery I spent hours working on and modifying and replaced with the simpler slider on the inner pages.  My question:  Should the client still pay for home jQuery slider I worked on and charged to implement the other jQuery slider on the home page?  I charge per feature/functionality when building a site. Therefore, if I just remove the slider, I'll lose money and time. I'm thinking they should pay for it since it was specified in the original scope...not my fault...  Second question, how should I present them with the charge, if I am charging them for it? 	TRUE
