16188485	Requirements for a personal project	Gathering requirements is an essential stage creating software or web applications.  I have searched the web extensively without finding any directions on how to elicit requirements for personal projects. All information i found - including books i read - is focussing on different stakeholders.   So i´m wondering, what would be the best way to 'gather' the requirements for personal projects?  I can't imagine i'm the only one with this question. I have plenty of ideas for webapplications. Since i am the only stakeholder at this time - no users are identified yet, i need to develop a couple of applications for personal use - i find it hard to interview my self to elicit those requirements.  As English is not my native language, apologies for possible textual errors. 	TRUE
15620602	Server bandwidth required for Podcasts and live radio	i need to set up a server that can host a podcast. Actually there are 30 listeners during a live radio, but they can grow up.  What kind of server requirements do I need?  I usually buy dedicated server from Hetzner. 	
15409974	Requirements that base on alrady existing requirements	Let's assume that there is a working system with planty of functions and the system is now going to be adjust for another country. Some functions stay as they are, some are going to be adjust and some are going to be define from scratch.  In which form would you write requirements in this situation? Should the new specification mentione about already existing functions? Should every function be described new? If there is a big use case which needs a small change for the new country should it be describe complet or just the diff? What about the context for such small change so that developers understand what it is about? 	TRUE
1125446	How do you verify that users&#39; requirements are addressed in the code you&#39;re working on?	Code can be perfect, and also perfectly useless at the same time. Getting requirements right is as important as making sure that requirements are implemented correctly.   How do you verify that users' requirements are addressed in the code you're working on? 	TRUE
3571535	Good interview questions for designers/requirement-writers	I'm trying to come up with a quick question or exercise to evaluate interviewees' design and communication skills for a requirements-writing position.  I've considered asking for a quick recipe (like for a grilled cheese sandwich), but that doesn't quite feel right. (recipes describe how to make something; requirements describe the resulting object itself).  I'm interested both in suggestions, and examples of good (or bad) questions you've been asked. 	TRUE
225154	Good pointers that a software requirement is in fact political?	Probably an easy one:  Are there any rules of thumb or pointers that could help recognise political requirements?  Let’s say one of stakeholders (your boss, a head of another department or an actual user) asks for a feature or particular characteristic of software being developed by yourself or your team. Is there a litmus test to determine whether requirement is political?  This question is really simple and is not about how to deal with political requirements or whether they are bad or good for software. How do you tell that whatever you have been asked to do is to pursue someone’s tacit or actually openly stated political agenda? 	TRUE
15152611	Is there a programming language that meets these requirements?	I have a few requirements before implementing my next program - hopefully a programming language exists that can do the following:   Given a class (or interface) C, the programming language allows the user access to a list of all classes which extend/implement C. The programming language allows the user to iterate through all the variables and methods of a class. The user is able to determine the number and types of arguments a function will take.  eg. foo(int a, String b, int c) can be queried  to return 3 or [int, String, int]    Are these absurd requirements or does some language implement them as basic techniques of reflection? 	
14931780	More productive Grooming Sessions	I'm looking for a way to make our Scrum Grooming Sessions more productive. At the moment, it feels like it's taking us a long time to create user stories and acceptance criteria. For a one hour session, we typically end up with 2 - 4 user stories including acceptance criteria. The process to get there feels painful, taking a long time.  Participants include members from Dev + Architecture, QA, BA, Customer, Product Owner (me), Usability.  The problem I see is that we have good discussions, but then the process of wording the stories - and even more so the Acceptance Criteria - takes an awfully long time.  Since we are a distributed team, we have to do this over the phone, screen sharing and a collaborative editing environment. This certainly has an impact on the productivity, since we're not in the same room, but I still feel that our process could be improved.  Some questions:   How many stories do you typically end up with after a Grooming Session? Do you create the Acceptance Criteria as part of the Grooming Session, or outside? How do you create User Stories and what process works for you?  	TRUE
14854034	Doxygen requirements tracking / inverse matrix	I use a custom Doxygen tag to track requirement implementations in my software source code, like so :  /// @req REQ-BLAH-0010   The @req tag is defined in my doxygen.conf file:  ALIASES += 'req=\xrefitem req \'Requirement\' \'Requirements\' '   This works, Doxygen generates a list of requirements for each method/class/file. But sometimes the same requirement number is used in different places, and I'd like a way to get the inverse list: for each requirement number, list all the places in which it is tracked.  Is this possible to do using Doxygen? If so, how? If not, what tool would you recommend for this? 	
14698458	What is the minimum OS for a windows console app made with Visual C++ 2010?	I've created a console application using Visual C++ 2010. What is the earliest version of windows I can run the program on? I know that it can depend on what Windows API functions that you use in the program, so I only use the following functions in my program:   GetStdHandle() SetConsoleTextAttribute()   Everything else in the program is standard C++. I know that console applications should be able to run on very early versions of Windows, but I do not know how VC++ 2010's compilation affects the minimum operating system requirement. So, would a console application compiled on Windows Vista with Visual C++ 2010 be able to run on, say, Windows 95, ect.? 	
14649905	EDI x12 Segment Conditions	Keep in mind that I started to tackle EDI standars a couple of days ago only so there are still a lot of nebulous things.  In an EDI segment (like CUR), when a condition is declared (P0304) it states that if one is use, the other should too.  What do them mean by 'use'?  Does it mean that the field has to be present in the segment or does it have to have a value in it? Can it be empty but still 'used'?  i.e. : CUR*SE*CAD**01  Would it be valid, since CUR03 is in the segment? Or would it be invalid because CUR03 is empty? 	
14486987	How are requirements of network specified to ensure QoS?	When I review the hardware requirements of many database backed enterprise solutions, I find requirements for the application server (OS, processor, RAM, disk space, etc), for the database server (versions, RAM, etc) and requirements for the client.  Here is an example of Oracle Fusion Middleware.  I cannot find requirements on network speed or architecture (switch speed, SAN IOPS,RIOPS, etc).  I do not want a bad user experience from my application but caused by network latency in the clients environment.  When sending clients required hardware requirements specifications, how do you note the requirements in these areas?  What are the relevant measures of network performance? (Or is it simply requiring IOPS=x ) 	
147182	Low Friction Minimal Requirements Gathering	How can our team gather requirements from our 'Product Owner' in as low friction yet useable of a way as possible?  Now here's the guidelines- No posts that it can't be done or that the business needs to make a decision that it cares about quality, yada yada. The product I work for is a small group that has been successful for years. I just want to help them step it up a notch.  Basically, I'm on a 6 or 7 person team with one Product Owner. She does a great job but is juggling a few different roles (as I believe is common on extremely small teams). Usually requirements are given at sporadic times (email convos, face to face discussions, meetings, etc). They are never entered into a system and sometimes this results in features missing a release or the release getting pushed back since everyone forgot about the necessary feature.  If you're in a similar situation but you found a way to overcome this, I'd love to hear it. I'm happy to write code to help ease this situation but it can't be a web site that the Product Owner has to go to in order to get anything done. She is extremely busy and we need some way of working together as a team in order to gather these requirements.  I'm currently thinking of something like this: Developers and team members gather requirements discussed in face to face meetings and write some quick notes on the features discussed on a wiki page. Product owner is notified whenever these pages are updated and it then becomes her responsibility to ensure accuracy.  Pros: We'll have some record of the features. Cons: The developers are taking responsibility for something that they ordinarily wouldn't. I'm okay with that here. I think in this situation it's teamwork.  Of course once we do this, then we're going to see that the product owner probably doesn't have enough time to ensure feature accuracy. Ultimately she is overburdened and I think this will help showcase that fact, but I just need to be able to draw attention to that first.  So any suggestions?  P.S. her time is extremely limited so it is considered unreasonable to expect her to need to type in the requirements after discussion. She only has time to discuss them once and move on. 	TRUE
14433400	Does a rating system violate twitter display requirements?	I'm confused about the new twitter display requirements.   BACKGROUND  I dynamically generate a page with a series of tweets based on their popularity. To the right of the tweets I have a like/dislike rating system which is used to determine the popularity of the tweet.  QUESTIONS  Am I allowed to place the like/dislike icons near the tweets?  Does the rating system violate any twitter developer rules? 	
6165775	How to write technical requirements	What is the right way to write technical requirements for the UI component in an application? I guess it's not clear to me whether the technical requirement should dictate how the UI should be implemented or it should be as general as possible and describe what are required to satisfy the functional requirements and forget about the implementation details.   Here are my specific questions:   Should it state what technology the UI will be implemented in? (eg, ActiveX, WPF, HTML).  Should I describe the layout, the colors? (given that that can change) Is it necessary to describe how the data is presented? (eg, does it need to say 'data is displayed in a table or list format' or 'a scrollbar shall appear is data cannot be fit on the screen'?) Do I need to describe how the UI should react to user input if that is a functional requirement? (eg, the functional requirement says 'it shall be clear to the user which action is current active'... should the technical requirement say 'the button shall change color to Red when user selects option a.. Blue when user selects option b.. etc') Is it necessary to state things that are common sense about the UI? For example,'it shall be position in such a way the entire content is visible'? or 'it shall have shadow so that it stands out from the rest of the screen'? (note: these are not functional requirements but they apply to any UI in general)  	TRUE
14200944	What do I need to know to build an HTTP server in C?	Some say that in order to build an HTTP server I should follow the RFC 2616 standards. Which is ok, but as a completely new C developer I would like to know what modules, techniques I will need to make implement the HTTP protocol to handles html, css, js and images.  I'm not trying to reinvent the well I just need a starting point to learn C. And my experience is that building something useful in a project manner is the best way to learn something new.  P.S. I would like to build it from scratch if it's possible. 	
14166717	What is the difference between &quot;system/subsystem&quot; and &quot;software&quot; in a SSS vs SRS?	What is the difference between a System/Subsystem Specification (SSS) and a Software Requirements Specification (SRS)? I am struggling to find a precise definition between System/Subsystem and Software. I know that the SRS is more detailed than the SSS in that it includes mentions of interface of how it interacts with other software and hardware. However,I still can't make the connection of how the SRS relates back to the SSS.   Any advice would be much appreciated. Thanks! 	TRUE
14043323	SRS: Can these to be included?	Think we are creating the 'Glossary' of an SRS in tabular format. It has 'Terms' and 'Definition' as columns.  I know the glossary of SRS includes 'Terms' such as QA, HTML, KPI etc, and their meaning under 'Definition' column. It seems like it is a place where we describe 'Initials'. However, can I add the following under the 'Terms' and describe them? (This is a SRS used for a Fire and Security alarming system, one of our final year projects)  zones central manned control area sprinkler   Please help 	TRUE
13494429	What is the difference between &quot;initial scope&quot; and &quot;requirements&quot;?	Thanks for taking the time to read this in advance.  I am writing an intermediate submission report for a project that I am re-engineering and my tutor wants a page summary, list of requirements (with justifications), an initial scope and a suggested architecture.  The main report will include analysis, design and implementation.  I've written everything apart from the initial scope. I'm really worried I'm going to repeat myself and I am unsure as to what the difference between my requirements and initial scope should be?  Here is an example of a requirement:     The first option on the main menu will be “New Game”      Current system: A user is automatically taken to a new game but they are restricted to     completing this game, before they can start a new one.      New system: The option to start a new game will give users more flexibility if they do     not wish to complete the current one. The default level for games will be “low” to begin with, unless this is changed by the user.  	TRUE
13670952	Unexpected behaviour with requered ordering position XML node on ServiceStack WS	Now as I know ServiceStack uses .NET's Xml DataContractSerializer to serialize/deserialize XML, but with it we have some truble in case when our webservice API used not .NET framework.  This problem very good described in this post if try short describe of problem:  Requirement of strict sequence of nodes XML is very uncomfortable for some external no. NET system.  Is it possible to use a different serialize or configure the ServiceStack used, so that he did not expect the elements in a rigidly defined positions? 	
13220078	OCL Requirement: Invariant for possible range of attribute values	So I have the following Object structure:  Class Node RSSI: int   I need to write a OCL invariant for the requirement that the the RSSI values of all Node objects do not differ by more than 2. I tried to solve it with an iterate expression but since you can't really use variables IN OCL to store current max and min values (or at least im not aware of how to do that) I don't know how to do that. Can anyone help me with that? 	
1957895	Defining minimum memory and free disk space requirements?	On page 42 of Code Code complete there's a checklist of requirement items you might want to consider during a requirement phase. On of the items (near the bottom of the list) says Are minimum machine memory and free disk space specified Has this ever been a requirement in any project you did and how did you define such a requirement before even starting to build stuff?  I know this is only a suggestion and frankly I don't think I will ever include that in my requirements, but it got me thinking (and this is the real question)..   How would one ever make an estimation of system requirements...  	
12910189	An example of requirements not reflecting user needs	I have read that software can pass the verification stage (all requirements are fullfiled) but fail at validation - requirements do not reflect what user wants.  I cannot think of an example where requirements actually miss the real used needs. (how would such requirements pass the requirement analysis validation?). I would be grateful for an example, thanks. 	TRUE
11409654	moscow with user-stories	I have adopted the user-story template introduced in response to a question here on SO, i.e.  AS A [person/role] I NEED TO [do something]  SO THAT [provides business value].   I have two questions:   How should I incorporate MOSCOW into user stories, which part of the template can / should change? I am re-writing requirements and often deal with statements about content being available on a website. I am unsure whether I should write the user-story from the perspective of a website user reading the content, or ad administrator making the content available. Can anyone clarify the best approach to take?  	TRUE
12207110	rpm spec file &quot;Suggests&quot; statement	I am currently refurbishing a lot of outdated specfiles, and I remember talking about soft dependencies, which would come in handy for a current specfile (i.e. lighttpd suggesting the most popular modules to be installed, like mod_rewrite, mod_redirect).  My main issue is, google seems to fail to release any bit of valuable information on the implementation status of the Suggests: statement, its current overall status and rpm version requirements. Most documents and howtos are from 2004 and earlier, too outdated to be considered a trustable source. The absolute rpm pdf does not state anything about the Suggests: tag either.  Thanks a lot for any information in advance.  Post scriptum: OpenSuSE &amp; Mageia seem to use it, but beyond that..   https://build.opensuse.org/package/view_file?file=meld.spec&amp;package=meld&amp;project=openSUSE%3AFactory  https://wiki.mageia.org/en/Packaging_for_beginners 	
12425570	How do I declare device capabilities for this app?	I have created an iOS 5.1 or later application for the iPhone 4S that requires a magnetometer, an accelerometer and also uses the Core Location framework  Apple's documentation is a bit confusing when it comes to declaring the device's required capabilities (confused over array or dictionary choice, entering YES/NO values, etc.) and I want to make sure I've added everything correctly.  This is what the relevant section of my info.plist looks like now :  Required Device Capabilities      Array    (4 items)           item 0                  String   magnetometer           item 1                  String   accelerometer           item 2                  String   location-services           item 3                  String   armv7 // was already added by default   (I have also added the name of the app and an appIcon in the appropriate fields)  Is the above information correct or do I need to add something more or change something?  Furthermore, the application was created to run on the iPhone 4S. But do the above requirements also let it run on other iPhone versions that I should include, or is the iOS 5.1 restriction limiting my app to only run on the iPhone 4S?  Should I also include somewhere that it can run on some version of iPod Touch or will it not run on one?  Thank you for your suggestions 	
11486309	Unified Process Analysis and Software Percentage Confusion	I want to ask something about Unified Process. In UP, every iteration has its own analysis and implementation steps.         But the above image shows something different. After iteration 5, 90% of analysis completed but just 10% of software completed. I can't understand that. In an iteration, codes are about iteration's requirements. So how could be software's completion ratio 10% and requirements' ratio 90%?   	
3291648	Which are SharePoint Server 2010 installation requirements ?	Wich are SharePoint Server 2010 installation requirements ? 	
3296014	How many users could run software that uses OpenGL 3.x?	Can I expect users to be able to run software that uses OpenGL 3.x?   Can Linux users who have open-source graphics drviers run OpenGL 3.x? I know that Mesa3D 7.8 only supports OpenGL 2.1.  I also know that OS X Snow Leopard supports some but not all OpenGL 3.0 features. I don't know the situation on Leopard.  I don't know the situation on XP, Vista, and Windows 7.  I'd like to start learning OpenGL, and my interest lies more in scientific and engineering applications than games. I know I'll be reading code that uses OpenGL 1.x, but I'd like to write code using the newest specification I can expect user's systems to support. I'm wondering whether I should start learning 2.1 or 3.3. I was thinking of getting either the 4th edition of the OpenGL Superbible to learn 2.1 or the 5th edition which is coming out July 30 to learn 3.3. (I have a bachelor's in physics, so my math background is pretty good.)    Edit: I found this related question with answers that are relevant to my question. 	
11718986	Connection between requirements and code in code	I am looking for simple way to connect information about requirement/release and source code. The case is that developer should be able to find any artifacts created given release or CR in easy way. The idea I have is to introduce some new annotation to mark any new class ( I am not sure if it is good for any new method) for example:  @ArtifactInfo(release='1.2' cr='cr123')   Do you have any other ideas? Maybe you use already something similar?  Take care, Marcin 	TRUE
9259321	Do these stacks need to be merged?	In a proficiency assessment as part of Exam 98-361, Software Development Fundamentals, this question pops up:     Scenario 3-3: Using Stacks      You are writing a program that uses two stacks. The data in each stack is already in descending order. You need to process the contents of both stacks in such a way that the output is printed on the screen ascending order. How would you write such a program?   Now, I have this scenario already coded. My solution is to iterate over two separate stacks, merge them into a List by popping their items off until the stack is empty, and sort the list into the correct order.  However, it strikes me that the question is a bit vague on whether or not I should be merging the stacks. It's kind of implied, but it kind of isn't.  If you were reading this question, how would you interpret it?  Note that I'm not actually taking this exam, just prepping for it. It's more of a requirements interpretation issue, at this point, in my mind. 	
479739	How do you manage customers with regards to changing requirements?	Steve Yegge's wisdom notwithstanding, most developers are faced with requirements which were gathered from non-technical customers.  Sometimes there are project managers who deal with the customers and translate their requirements, other times not.  In any event, the fact that the requirements will change is an inevitability.  Most of what consititues 'good programming practice' has to do with developing systems which are adaptable so that they can withstand changing requirements.  Principles like YAGNI, DRY, loose coupling, etc. contribute to this.  Iterative development processes such as Agile also attempt to address the concern of trying to hit a moving target, and of course having a system under test makes it infinitely more feasible to make changes.  Nonetheless, it seems that for many of us changing requirements can not only hurt the quality of our software, but can also drain our motivation and make us want to stab someone.  This question is about how to manage the customer to make it possible for them to change their requirements in the ways that they need, while discouraging arbitrary or frivolous changes.  How do you do it?   Do you have project managers to insulate the devs from the customer? Do you have a formal change management process?  Change managers? How difficult is it for the customer to get a change when they really need it? Conversely, how easy is it for a customer to get a change when it's 'frivolous'? How much detail do you give the customer when explaining the cost of a change? How quickly are you able to give the customer this information after receiving a request for change? What factors can torpedo the process (e.g. PM's who can't say no to the customer?) What works for you?  	TRUE
