56086834	Requirements gathering questionarie templete	I have a client who ask me to redesign his e-learning website,and we had a first call he explained everything about his website.Now how I prepare a questionnaire template for asking him about all the functionalities in the website and about the design of the website.  Thanks in advance. 	TRUE
31684375	Automatically create requirements.txt	Sometimes I download the python source code from github and don't know how to install all the dependencies. If there is no requirements.txt file I have to create it by hands.  The question is: Given the python source code directory is it possible to create requirements.txt automatically from the import section? 	
56010337	Amazon sagemaker. SKlearn estimator vs Tensorflow estimator - why requirements_file is not present in one of them?	I am looking at definitions of two estimators SKLearn and Tensorflow in Amazon Sagemaker:  SKLearn  Tensorflow  class sagemaker.sklearn.estimator.SKLearn(entry_point, framework_version='0.20.0', source_dir=None, hyperparameters=None, py_version='py3', image_name=None, **kwargs)  class sagemaker.tensorflow.estimator.TensorFlow(training_steps=None, evaluation_steps=None, checkpoint_path=None, py_version='py2', framework_version=None, model_dir=None, requirements_file='', image_name=None, script_mode=False, distributions=None, **kwargs)   Tensorflow has requirements_file parameter, while SKLearn does not. Is there reason why? How can I add requirements.txt to SKLearn estimator? 	
55947978	EB deployment fails with &#39;requirements.txt&#39; returned non-zero exit status&#39; - No matching distribution found for pywin32==224	I'm just trying to get my application running on EB - but when I run eb deploy, it uploads the code and then the console runs into an error before the app is running.     Command failed on instance. Return code: 1 Output: (TRUNCATED)...) File '/usr/lib64/python2.7/subprocess.py', line 190, in check_call raise CalledProcessError(retcode, cmd) CalledProcessError: Command '/opt/python/run/venv/bin/pip install -r /opt/python/ondeck/app/requirements.txt' returned non-zero exit status 1. Hook /opt/elasticbeanstalk/hooks/appdeploy/pre/03deploy.py failed. For more detail, check /var/log/eb-activity.log using console or EB CLI.   I check the logs to see where the error is with regard to requirements.txt, and this is what I can see:  var/log/eb-commandprocessor.log -------------------------------------    https://files.pythonhosted.org/packages/61/28/1d3920e4d1d50b19bc5d24398a7cd85cc7b9a75a490570d5a30c57622d34/pytz-2018.9-py2.py3-none-any.whl   Collecting pywin32==224 (from -r /opt/python/ondeck/app/requirements.txt (line 92))     Could not find a version that satisfies the requirement pywin32==224 (from -r /opt/python/ondeck/app/requirements.txt (line 92)) (from versions: )   No matching distribution found for pywin32==224 (from -r /opt/python/ondeck/app/requirements.txt (line 92))   You are using pip version 9.0.1, however version 19.1 is available.   You should consider upgrading via the 'pip install --upgrade pip' command.   2019-05-02 07:33:21,688 ERROR    Error installing dependencies: Command '/opt/python/run/venv/bin/pip install -r /opt/python/ondeck/app/requirements.txt' returned non-zero exit status 1   Traceback (most recent call last):     File '/opt/elasticbeanstalk/hooks/appdeploy/pre/03deploy.py', line 22, in main       install_dependencies()     File '/opt/elasticbeanstalk/hooks/appdeploy/pre/03deploy.py', line 18, in install_dependencies       check_call('%s install -r %s' % (os.path.join(APP_VIRTUAL_ENV, 'bin', 'pip'), requirements_file), shell=True)     File '/usr/lib64/python2.7/subprocess.py', line 190, in check_call       raise CalledProcessError(retcode, cmd)   CalledProcessError: Command '/opt/python/run/venv/bin/pip install -r /opt/python/ondeck/app/requirements.txt' returned non-zero exit status 1 (Executor::NonZeroExitStatus)   On my virtual env, these are the relevant parts of my requirements.txt  pypiwin32==223 pywin32==224    I'm running python version 3.7.2, Django version 2.1  I've seen a few threads on this elsewhere, but no definitive answer about what to do...? 	
55783188	No matching distribution found for Babel==2.3.4	I am trying to install Odoo in a local environment.  I installed the newest version of Python3 and also updated my .bash_profile file like this:  # Setting PATH for Python 3.5 # The orginal version is saved in .bash_profile.pysave PATH='/Library/Frameworks/Python.framework/Versions/3.5/bin:${PATH}' export PATH if which rbenv &gt; /dev/null; then eval '$(rbenv init -)'; fi if which rbenv &gt; /dev/null; then eval '$(rbenv init -)'; fi  alias python='/usr/local/bin/python3'   if i try to run Odoo like this:   ./odoo-bin --addons-path=addons,../mymodules --db-filter=mydb$   i get:   ./odoo-bin --addons-path=addons,../mymodules --db-filter=mydb$ Traceback (most recent call last): File './odoo-bin', line 5, in &lt;module&gt; import odoo File '/Users/separator/odoo/odoo/__init__.py', line 74, in &lt;module&gt; import babel ImportError: No module named 'babel'   now when im trying to instal the requirements like this:  pip3 install -r requirements.txt   i get:   pip3 install -r requirements.txt Ignoring gevent: markers 'sys_platform != 'win32' and python_version &gt;=  '3.7'' don't match your environment Ignoring greenlet: markers 'python_version &gt;= '3.7'' don't match your  environment Ignoring lxml: markers 'sys_platform != 'win32' and python_version &gt;= '3.7'' don't match your environment Ignoring lxml: markers 'sys_platform == 'win32'' don't match your environment Ignoring pypiwin32: markers 'sys_platform == 'win32'' don't match your environment Collecting Babel==2.3.4 (from -r requirements.txt (line 1)) Could not find a version that satisfies the requirement Babel==2.3.4 (from -r requirements.txt (line 1)) (from versions: ) No matching distribution found for Babel==2.3.4 (from -r requirements.txt (line 1))   When using   pip install -r requirements.txt   it installs the them just fine but in the Python2.7 folder and not in the Python3.x which i need to use because of the Odoo12 which only supports Python3.x  i even uninstalled python from my mac (both versions) and re-installed them but it didn't fix the issue im trying to fix this for days but no joy. any help would be appreciated!  thanks in advance! 	
43264418	How to phrase requirements around cyber security?	I'm stuck trying to write software requirements around cyber security.  I'm designing a system where two devices communicate over Bluetooth, and (for example) I am going to (1) enable the BLE feature to help guard against Man-in-the-Middle attacks, and (2) add more code to make it even less likely.  Where I'm stuck, is writing the requirement for this feature.  I can't say 'The app shall prevent Man-in-the-Middle attacks' because that's not testable.  I can't say 'The app shall work really hard to prevent Man-in-the-Middle attacks' because it sounds stupid and is not testable.  I have similar problems writing the requirements for the code I'm implementing to guard against Denial of Service attacks and general eavesdropping.  Note that I'm not asking how to do this in Bluetooth - I'm looking for help in writing the requirements document for this application so that the resulting requirements are 'Unambiguous, Testable (verifiable), Clear (concise, terse, simple, precise), Correct, Understandable, Feasible (realistic, possible), Independent, and Atomic.' 	TRUE
55663926	Project Requirement Dependencies or Limitation	I would like to apologize first if the title is misleading. What I would like to find out is when a product need to be able to run in the browser, iOS, and Android, what minimum system or software limitation that we need to inform the client? like the product only supports below system or software:  For website  - minimum Chrome version 70   minimum Safari version 11 minimum Firefox version 60 minimum Microsoft Edge version 40 Screen resolution (width x height) for desktop, laptop, tablet and smartphone like 2880×1800, 2732x2048, 2560x1600, 1366x768, 2048x1536, 1280x800, and etc   For OS   Windows 10 and above MacOS version 9 and above iOS version 10 and above Android version 7 and above   For native app   iOS and Android app will not be 100% in term of UI and UX. Similarity range is 70% to 95%. For example, Whatsapp or Facebook UI and UX is not 100% the same for both iOS and Android platform.   If anyone has more to add please share it here. thanks!  I have a bad experience that the company PM did not specify system or software limitation or dependencies in the contract and made the developer have to write code to support the old version of the browser or platform which delay the project delivery for almost 4 months LOL. At least if we tell the client that the product can only support a certain platform or browser, then we all have mutual understanding. 	
54668439	When shall I create UML diagrams when developing software?	I am currently working on a new software and I am not sure how to go on.  I already started coding before having a good plan.  My opinion was to start with below sequence   Create User Stories Create BMSC &amp; Hsmc Code the required features Test Refactor &amp; solve bugs   Now I want to know where do I put the UML Diagram, before coding or after coding? 	TRUE
16475979	What is the difference between functional and non functional requirement?	What is the difference between functional and non-functional requirements in the context of designing a software system?  Give examples for each case. 	TRUE
213303	Software Requirements Analysis	There are many tools out there for writing and managing requirements, but are there any good ones for reviewing them?    I'm not talking about managing reviews, but automation tools that look for common requirement blunders (such as using negative requirements, or ones that are worded in a way that makes testing difficult). More of a screening tool that someone writing requirements can use to screen their document before distributing to a group of reviewers so that the review process need not be slowed down by everyone commenting on the same easily recognizable issues.  I'm curious if anyone's used anything like this in the past. 	TRUE
55406955	How to generate a KAOS diagram?	I am taking a class on Requirements Engineering and it involves making various diagrams. I used PlantUML to make Sequence and Use Case diagrams. But now I need to make KAOS diagrams. I don't think that PlantUML has everything I need for creating KAOS diagrams or even flowcharts. I could use activity diagram but it doesn't have parallelograms. Is there any software you know about which can help with creating KAOS diagrams or even flowcharts from some kind of script (like PlantUML)? 	TRUE
55152598	General-purpose/generic test for container requirements compliance?	Suppose you're writing a container, to meet the C++ container requirements. What should I do to make sure it's properly compliant? And Is it possible to have some general-purpose compliance 'torture' test into which you plug any container's code and it passes compilation if and only if you actually meet the requirements?  PS - Let's assume C++14 or C++17, no C++20 and no concepts involved please. 	
55091129	How can computational requirements be compared?	Calculating the solution to an optimization problem takes a 2 GHz CPU one hour. During this process there are no background processes, no RAM is being used and the CPU is at 100% capacity.   Based on this information, can it be derived that a 1 GHz CPU will take two hours to solve the same problem? 	
55077140	How to write structured, testable requirements on software API?	Could you please give some guidance on how to write structured, testable requirements on software API (functions)?  For example, let's look at the following documentation:  _Unwind_Reason _Unwind_RaiseException( struct _Unwind_Exception *exception_object );  Raise an exception, passing along the given exception object, which should have its exception_class and exception_cleanup fields set. The exception object has been allocated by the language-specific runtime, and has a language-specific format, except that it must contain an _Unwind_Exception struct (see Exception Header above). _Unwind_RaiseException does not return, unless an error condition is found (such as no handler for the exception, bad stack format, etc.). In such a case, an _Unwind_Reason_Code value is returned. Possibilities are:  - _URC_END_OF_STACK: The unwinder encountered the end of the stack during phase 1, without finding a handler. The unwind runtime will not have modified the stack. The C++ runtime will normally call uncaught_exception() in this case.  - _URC_FATAL_PHASE1_ERROR: The unwinder encountered an unexpected error during phase 1, e.g. stack corruption. The unwind runtime will not have modified the stack. The C++ runtime will normally call terminate() in this case.  If the unwinder encounters an unexpected error during phase 2, it should return _URC_FATAL_PHASE2_ERROR to its caller.   This is a documentation. It must be translated into a set (hierarchical list?) of requirements, and each requirement must have its own unique id and must be clearly testable.   I will be very grateful for your advice! 	TRUE
42672957	C# 7 .NET / CLR / Visual Studio version requirements	What are the minimum .NET framework and CLR version requirements for running C# 7? Also, do I need VS 2017 to compile C# 7? 	
54842534	Shall Statement System Function Requirements vs Use Cases	Question: Why do system/software development businesses favor use case requirements over shall statement system requirements?    Comparison:    Functional requirements of a system is generally defined with either of:  1-traditional shall statement system requirements  2-use cases (textual or diagram)  Both of these approaches are tried to be used such to provide system requirements as treating the system as 'black box', i.e. the requirements should not to define sub-system detail.  I feel traditional shall statements are abandoned, however i also think them are well-defining for the system. I do not find use-cases by nature as a way of writing SMART or good requirements. They are either not atomic, not testable, defining or depended to other system behavior, over-defining system, or defining sub-system behavior to define system interactions. I think, traditional shall statement requirements are better by their atomic nature for requirement management. However, i have seen it is also criticized as difficult to complete, when completed difficult to adapt to changes. I argue otherwise. They might be difficult to complete, but you have to have complete requirements. You might not start with a complete set, but you can complete, as you go. I do not also think they are hard to adapt changes. I think, with use cases, single change is more prone to effect other parts of requirements. But good shall-statement requirements are supposed to be atomic. With a traceable requirement management, for example any change in interfaces, can easily point to which requirements to change/remove/add. You can even abstract your requirements from the interface detail, by using symbols for interface elements, in order to increase your ability to adapt changes in interfaces.    EXAMPLE:    I want to further elaborate with the following example. For the sake of simplicity, the functional definition will be small.  Let's say, i have a system consisting of 4 subsystems. System1 controls system2. System2 controls system3 and system4. System2 has the capability of powering on and off System3 and System4. System1 sends message1 to system2, for controlling system3. System1 sends message2 to system2, for controlling system4. The system that i need to define is system2.   Use case approach:  MAIN FLOW   system2 receives 'message1' message from 'system1' (Alternative statement: system1 sends 'message1' to system2.) system2 receives 'power on system3'. system2 powers on 'system3' system2 receives 'message2' message from 'system1' (Alternative statement: system1 sends 'message2' to system2.) system2 receives 'power on system4'. system2 powers on 'system4'.   Alternative Flow1(MF.2):  1. system2 receives 'power off system3'.  2. system2 powers off 'system3'  Alternative Flow2(MF.4):  1. system2 receives 'power off system4'.  2. system2 powers off 'system4'  Shall Statement Requirements:  REQ1: 'System2' shall power on 'system3', if 'system1' applied 'power on system3' with message 'message1'.  REQ2: 'System2' shall power off 'system3', if 'system1' applied 'power off system3' with message 'message1'.  REQ3: 'System2' shall power on 'system4', if 'system1' applied 'power on system4' with message 'message2'.  REQ4: 'System2' shall power off 'system4', if 'system1' applied 'power off system4' with message 'message2'.  Note: I would even combine REQ1 and REQ2 as one requirement, and REQ3 and REQ4 as one requirement, since they are two distinct set of requirements, whose union defines every condition applied by the user system ('system1').  I think that a requirement should be clear, realizable, testable, not-conflicting with other requirements, time-bound if necessary, not-defining with subsystem behavior, not over-defining, not-defining behavior of other interacting systems, defining in which condition it is fulfilled. I think the shall-statement requirements are good enough. You can simply realize them and just write simple test-cases and verify the system.  For the use case statements, i think, we have to define if each of the steps in the main flow is a requirement, or if the whole scenario is one single requirement.  If each of the steps is a requirement, then i think step 1,2 defines other system behavior if it is written in alternative way, and they are not testable, since only way to test is to ask the system if it received the message. step 3. could be okay, but what we want is that requirement to be fulfilled if step 1&amp;2 happened before. Since step3 does not reference step1&amp;2, step3 cannot be a standalone requirement.  I think we should regard all of them as one single requirement. I find this view is more feasible, nevertheless i think, this view has pitfalls too.   Still step 1. is defining other system behavior, or dependent on it. You might argue otherwise by saying it is a precondition of the whole scenario, but in that case step 4. is also defining other system behavior. I think the requirements should not depend on what other systems are supposed to do, rather define all-cases not depending to other systems.   Furthermore, since the use case is a sequence, now we are also defining 'power system3' operations are before 'power system4' operations. But in the role of a system engineer, that is not something i want to define for system2. System2 should process in which order, the orders came. Sequencing these operations is over-defining and sub-system behavior, to-me.  I tried to make the example simple. But in extensive real life scenarios, use cases are generally long, they have to define unnecessary sub-system behavior in order to be able to define system interactions, not atomic, not testable or generating test-cases is not as natural as it is with shall-statement requirements, which are atomic. Since the use-cases are long, they are composed of multiple atomic shall-statement requirements. If whole long scenario of a use case of lots of atomic requirements is seen as one single requirement, then when the related test-case fails, then how to pinpoint and document the problem.  	TRUE
169765	How do you get non-technical folks to appreciate a non-UI problem?	Suppose you're working on an enterprise project in which you have to get management signoff in order for you to develop a new feature set. Usually your management has no problem signing off on some bright shiny new UI feature. Unfortunately they have a hard time appreciating some behind-the-scenes issues that are crucial to the application's well-being such as transactions, data integrity, workflow routing, configurability, security, etc. Since they're non-technical and these issues are not immediately visible, it's not obvious to them that this is crucial.  How have you convinced them that these infrastructural issues have to be dealt with and that it is important to their business process? 	TRUE
54690373	Doxygen custom tag with a placeholder	Is it somehow possible in Doxygen to create a custom tag, which creates a documentation using a placeholder tag as its input?  What I want to accomplish is to create a custom tag for requirements. As our DOORS Urls are quite long, and diverge from SW-component to SW-component, I want to create something similar to this:  @file somefile.c @doorsdocurl &lt;URL to DOORS document&gt; -&gt; this is going to be my placeholder  ... ... ...   /** * @brief somedescription * @req{doorsdocurl: &lt;reqID1, reqID2,...&gt; } -&gt; this is going to be the second custom tag */ void jambo() { }   Is this somehow achievable with Doxygen? From what I have read, one has to put his custom tags within the ALIASES variable 	
54687228	DOORS creates Object ID while they are not saved	I am adding some 2000 new objects to a DOORS module, I do this by importing a spread sheet with blank IDs, DOORS is supposed to create IDs for those blank rows. Now the problem is, while i import spreadsheet, DOORS hangs, then when i Kill DOORS process, it anyhow creates IDs, next time when i add a new object, ID number starts from those which are already created but no exist. For some reason i need to continue from my last saved ID. Is there any way I can do this?  	
54535865	I Need help finding a list of non-functional requirement benchmarks?	I am doing a course on Non-functional testing and I need to find and test an open source program. I have found a ton of programs that I would like to use but unfortunately, not many of the programs come with the non-functional requirements which I need.   Can someone who works with creating these programs advise what are the common non function requirements for a online music application?  Or is their a direction I can go in to find a program that includes the code and the non functional requirements?  I have tried searching online through github for many various programs. The ones that do have non-functional requirements are very vague such as 'Must run fast' or 'Must never crash' 	TRUE
54496513	functional vs technical requirement	building a web base drawing application. While capturing requirement I am putting below likes under technical   Building web base application in HTML5 and JS framework is my technical requirement It should run in browsers, chrome, firefox etc   Below requirements are Functional or I can put them in technical too?  Requirements like it should allow preview while printing, and able to print  It should allow customizing toolbars 	TRUE
54234482	Startup Services AddAuthorization AddPolicy: EmptyRequirement	I'm little bit new in web development. I have an RestController which has many method e.g. (Get, GetById, Create, Update). I use Authorize Attribute, which used with Policy. This policy depend on a bool variable. You can see at below.   Now I use this workaround but I search more nice solution.   services.AddAuthorization(o =&gt;     {         o.AddPolicy('UserRoleCheck', p =&gt;         {             if (C.RequiredAuth)             {                 p.RequireAuthenticatedUser();                 p.AssertRole(Roles.User);             }             else             {                 p.AddRequirements(new EmptyRequirement()); // Here I don't want to else branch             }          });     });    public class EmptyRequirement : AuthorizationHandler&lt;EmptyRequirement&gt;, IAuthorizationRequirement {     protected override Task HandleRequirementAsync(AuthorizationHandlerContext context, EmptyRequirement requirement)     {         context.Succeed(requirement);         return Task.CompletedTask;     } }   It's work, but can You offer me more beautiful solution? 	
13673163	android minimum hardware specs for dev machine - can i code using a notebook?	So far I have been developing directly on my galaxy nexus and nexus 7 using the amazing AID app.  However, as the N7 can't provide logs due to it being jelly bean, i feel the need to get a mini notebook in order to utilise adb logcat.  My main worry is that something with only 1gb (2gb if i upgrade, which i will) and a 1.5-1.83GHz atom CPU won't be powerful enough.  I can possibly get around certain worries by not using emulators and testing directly on my two devices, so that will save me a great deal. Also I am tempted to just use vim and command line tools instead of eclipse which again might save me from a slow PC.  What do you guys think? Is the notebook way under powered? What if i just use vim and no emulators?   Side note, does anyone actually code in vim/command line? 	
54290713	ISO/IEEE Standard for Username	Are there any standards (ISO, IEEE etc.) that regulate the number and type of characters in the Username? It is assumed that the user enters the username and password to log into the application. 	
