41747604	Loadrunner - New install and requirements	I am about to start a new project where there will be a need to use Loadrunner. I do not have indepth experience of using this software however we are in the process of acquiring this product from HP but need clarification on the below questions.  Need for Loadrunner The application is a Windows application where thousands of users can be logged in at the same time performing different tasks (updating records, uploading documents, running searches and many more tasks)  Questions 1.How many Virtual Users are required for testing? 2.Which Protocol(s) are required?  3.is this a perpetual license or Term (options are 1 Month, 3 Month, 12 Month and Perpetual).  Any help would be much appreciated, apologies in advance if my question seems a bit vague. I am a new to this, thanks. 	
38761365	Trace backlog user stories to requirements in Enterprise Architect	I work on the IT site in an agile project where the business uses a back log and user stories to capture business requirements. The IT team uses Enterprise architect to model the application, system requirements being one of the elements.   What are the best practices for tracing the backlog user stories to the system requirements? Reason for tracing is to demonstrate the business requirements have been implemented.   And how to handle user stories that changes a EA requirement? Trace the req to both user stories? As one user story will be invalid this somehow feels redundant?  A briljant idea, anyone? Silver bullet also accepted..  	TRUE
28509965	Setuptools &quot;development&quot; Requirements	TL;DR: Is there a way to hook setuptool's 'develop' to install a set of development requirements when running python setup.py develop?   I'm building my first python package using setuptools. I'm specifying the requirements as:  requirements = [     'click',     'ansible',     'fabric',     'gitpython',     'pyyaml',     'jinja2',     'yapsy' ]  test_requirements = [     'pytest',     'pytest-pep8',     'pytest-cov', ]  setup( ...     install_requires=requirements,     tests_require=test_requirements, ... )   During development, I've been installing the package (in a virtual environment) with:  python setup.py develop   and uninstalling with:  python setup.py develop -u   The package uses entry_points to install some command line scripts, so this sets up the commands for me and allows me to edit the package while testing the command at the same time.  I also have some dependencies that I use for development ... sphinx + extensions and a couple other things (things that aren't needed to use the package). I'm just manually installing them in the virtual environment at the moment. I didn't see any documentation (and haven't found any examples on the googles) about how to wire them in with setuptools.  Maybe there's a way to hook 'setup.py develop' to install an additional set of requirements? Another method I haven't read about? 	
18795622	Why there is no pure java djvu encoders?	If there is not any Java library that can encode djvu, what kind of potential difficulties may appear while trying to implement it? 	
41803414	System requirements for Wakanda Server	When deploying a Wakanda (javascript) app with Wakanda server, what are the minimum  system requirements? And what system requirements can be recommended to customers? Are there any limitations to specific Windows or macOS versions? 	
41759165	Good (standardized) methodology to specify binary telegrams/protocols	I'm looking for a technical specification methodology to specify binary data. I'm looking for something like an XML Schema Description (XSD) is for XML.  The aim is to use the format to generate programs that can interprete binary sequences correctly; i.e. a programming language binding. This would be just like there are many frameworks for XSD which can generate Classes in OO-Programming language that can represent XML-Data, parse and serialize. Still, the methodology needs to be highly human-readable such that domain experts can specify and interprete this textual specification.  So far I only found human-readable syntaxes. In many standards ASCII-Art is used, like in RFCs or AMQP like this:  0                   1                   2                   3 0 1 2 3 4 5 6 7 8 9 0 1 2 3 4 5 6 7 8 9 0 1 2 3 4 5 6 7 8 9 0 1 +-+-+-+-+-+-+-+-+-+-+-+-+-+-+-+-+-+-+-+-+-+-+-+-+-+-+-+-+-+-+-+-+ |          Source Port          |       Destination Port        | +-+-+-+-+-+-+-+-+-+-+-+-+-+-+-+-+-+-+-+-+-+-+-+-+-+-+-+-+-+-+-+-+ |                        Sequence Number                        | +-+-+-+-+-+-+-+-+-+-+-+-+-+-+-+-+-+-+-+-+-+-+-+-+-+-+-+-+-+-+-+-+ |                    Acknowledgment Number                      | +-+-+-+-+-+-+-+-+-+-+-+-+-+-+-+-+-+-+-+-+-+-+-+-+-+-+-+-+-+-+-+-+ |  Data |           |U|A|P|R|S|F|                               | | Offset| Reserved  |R|C|S|S|Y|I|            Window             | |       |           |G|K|H|T|N|N|                               | +-+-+-+-+-+-+-+-+-+-+-+-+-+-+-+-+-+-+-+-+-+-+-+-+-+-+-+-+-+-+-+-+ |           Checksum            |         Urgent Pointer        | +-+-+-+-+-+-+-+-+-+-+-+-+-+-+-+-+-+-+-+-+-+-+-+-+-+-+-+-+-+-+-+-+ |                    Options                    |    Padding    | +-+-+-+-+-+-+-+-+-+-+-+-+-+-+-+-+-+-+-+-+-+-+-+-+-+-+-+-+-+-+-+-+ |                             data                              | +-+-+-+-+-+-+-+-+-+-+-+-+-+-+-+-+-+-+-+-+-+-+-+-+-+-+-+-+-+-+-+-+                         TCP Header Format   However, this is hardly machine readable.  Sometimes I saw specifications in Extended Backus Naur Form. However, this is not really readable by technical domain-people and I am not really aware of a standard that suggests this method to specify binary data.  Can anyone suggest a suitable methodology/standard?  Cheers, Hauke 	
41451283	INCLUDE statement in the alternate flow of a business use case	I'm doing a requirements analysis for a system and currently I try to write the business use cases (BUC) and make business use case diagram. I currently use the following guidelines:   When I have optional extra steps for a BUC I use an EXTEND-statement to point to the BUC where these optional steps can be found. Both the BUC that extends and the one that is extended can exist on it's own. When I have duplicate functionality in multiple BUC's I try to extract the this and put it in a separate BUC. Then I use an INCLUDE-statement in the BUC where I extracted the functionality, to point to the BUC where this functionality can be found. The BUC in which you point to the external BUC with the INCLUDE-statement cannot work on it's own.   This all worked fine for until I arrived at the following situation:   In the alternate flow of a BUC (let's call this one A) there's duplicate functionality that I already have specified in another BUC (let's call this one B). So naturally I want to use the INCLUDE-statement to point to B. If I do this I also have to show this in my business use case diagram. If I draw an INCLUDE arrow in the diagram (from A to B) it looks like A cannot exist without B. However this is not the case, as A only needs B when it's in the alternate flow.   I considered following options:   I keep all the functionality in the the alternate flow, but this makes the alternate flow too long and creates duplicate functionality. I use extend instead, but this imposes that B is optional while if you are in the alternate flow of A, you have to go through B.   Any thoughts? 	TRUE
27421340	Smartphone hardware requirement for android OCR app?	Apologies in advance if the question sounds dumb.Here's my problem  I want to make an OCR app for android smartphones.I am wondering if someone can tell me how much RAM and processor will be enough for image processing involved in it?I am trying to extract all the text from a printed A4 page in one go, how much should be the camera resolution for having a clear image of all characters? 	
41246203	How to make modal box appear only after all requirements have been met?	So I have a form, which asks for the user's personal information. At the end of the form I have set a modal to pop up, which says 'Thank you for signing up with us etc.'. However, even if you leave all the fields blank and you click on the button at the end of the form, the modal still pop up saying 'Thank you for signing up with us...'.  How can I set the modal to appear only after all the fields are completed?  Note: I need the personal information to remain on the page after I click the button at the end of the form. I changed the type from submit to button, but as soon as I fill in the last question and i click on the button, all the input disappears.  Any help would be much appreciated !  Here's the form:  &lt;form id='personalinfo' name='personalinfo' onsubmit='ask()'&gt;     &lt;b&gt;Please sign up with us before you proceed:&lt;/b&gt;&lt;br&gt;     First Name: &lt;input name='firstname' required='' size='40' type='text'&gt;&lt;br&gt;     &lt;br&gt;     Last Name: &lt;input name='lastname' required='' size='40' type='text'&gt;&lt;br&gt;     &lt;br&gt;     Age: &lt;select name='dropdown'&gt;         &lt;option value='1'&gt;10-18&lt;/option&gt;         &lt;option value='2'&gt;19-25&lt;/option&gt;         &lt;option value='3'&gt;26-35&lt;/option&gt;         &lt;option value='4'&gt;36-45&lt;/option&gt;         &lt;option value='5'&gt;46-55&lt;/option&gt;         &lt;option value='6'&gt;56-65&lt;/option&gt;         &lt;option value='6'&gt;65+&lt;/option&gt;     &lt;/select&gt;&lt;br&gt;     &lt;br&gt;     Gender: &lt;input name='gender' required='' type='radio' value='male'&gt; Male&lt;br&gt;     &lt;input name='gender' required='' type='radio' value='female'&gt; Female&lt;br&gt;     &lt;input name='gender' required='' type='radio' value='other'&gt; Other&lt;br&gt;     &lt;br&gt;     &lt;br&gt;     &lt;button id='OK!'&gt;OK!&lt;/button&gt; &lt;/form&gt;  &lt;div id='myModal' class='modal' type='button'&gt;     &lt;div class='modal-content'&gt;         &lt;span class='close'&gt;&amp;times;&lt;/span&gt;         &lt;p&gt;Thank you for signing up with us ! You can now proceed to the test.&lt;/p&gt;     &lt;/div&gt; &lt;/div&gt;  &lt;script&gt;     var modal = document.getElementById('myModal');     var btn = document.getElementById('OK!');     var span = document.getElementsByClassName('close')[0];      btn.onclick = function()      {         modal.style.display = 'block';     }      span.onclick = function()      {         modal.style.display = 'none';     }      window.onclick = function(event)      {         if (event.target == modal)          {             modal.style.display = 'none';         }     }  &lt;/script&gt; &lt;/form&gt;  	
41122605	Specify requirements for a REST server	I am writing the requirements that a REST web-sever that needs to implement. One of the non-functional requirements is that each function (component) of the system can be activated or deactivated independent of the other ones.   To make it more clear, the web server offers different services, the services provider should be able to deactivate one of the offered services at any time without affecting the other ones.   Is there a word describing this specification that could be wrote in the requirements and make a developer understand the needs ? 	
4387459	Requirements ( Functional , non-functional and user requirements)	can you please provide examples on requirements of the type ( functional , non-functional and user requirements ) of a website social network ( lets say the facebook ) ?  thanx in advance 	TRUE
40989833	Will android app crash if manifest use class not defined?	If we need to use a service say tvinputservice in Manifest but the service is available with android.software.live_tv. If a device doesn't have android.software.live_tv and we put tvinputservice in Manifest. Will the app crash on that device? 	
40440496	Passing a JSON string to HTTP GET method using libcurl	I want to pass a JSON string via the HTTP GET method. Server side requires a JSON as follows:  const char* json[]= {\'revisions\':[{\'revision\':\'01\'},{\'revision\':\'02\'},{\'revision\':\'03\'},{\'revision\':\'04\'}]}   So I intend to pass such JSON like this, but I'm not sure whether I should convert it to a query string format or not, like this:  curl_easy_setopt(curl, CURLOPT_URL, 'http://example.com?{\'revisions\'[{\'revision\':\'01\'},{\'revision\':\'02\'},{\'revision\':\'03\'},{\'revision\':\'04\'}]}');   I know I should use POST in this case. However, the requirement from server side requires using GET. Any help would be appreciated. 	FALSE
40434632	How to define effective use case?	I'm trying to define use cases for my project. The problem is I'm not sure how to effectively define a use case, and it looks very messy.  For example like my use case below. I feel like 'View profile', 'View Club' 'View Workshop' is necessary to include because of 'common sense' for user to click on certain profile to view it. So do I really need to define such use cases?  Car Club Use Case 	TRUE
39982045	How does node.js know express.js location	How does my node.js server know how to find the express.js file?  In my server.js file I have a requirement for express:  var express        = require('express'); var app            = express();   My server.js file is in the app folder while express.js is in the app\node_modules\express\lib folder:    express.js is here in the lib directory    Does node.js automatically know to look in node_modules for dependencies? There is no direct enumeration of the path anywhere - I don't see it in the code.   This is a sample project from scotch.io and I'm trying to pick it apart and learn. I'm pretty new to the MEAN stack and I'm trying to understand this at a basic level.  FYI this is node v 4.5.0 	
19176730	Are there exceptions to the rule that requirements should be atomic?	I'm reviewing a requirements spec where some of the requirements include the word 'and' or sometimes even a list of required functionality.  Am mostly thinking these should be broken up but this does have the downside of making a long document even longer and even less readable - which in practice may mean its intended audience ends up skimming over it or only reading sections rather than absorbing the whole thing.  However, there are some requirements where it seems a bit silly to break them up. E.g: there are a lot of get/set operations, which always go together - it seems a bit overkill to always break them up into 'The user shall be able to get...', 'The user shall be able to set...' Other examples are enable/disable, validation lists, supported platforms/browsers etc.  Just wondering if anyone has had similar thoughts and whether it might sometimes be OK to break the rule of atomicity? 	TRUE
37909513	UML - Use case scenarios &amp; data dictionaries	I am currently working for a company writing use cases.  They have a template which mixes them with data dictionaries.  I've never seen this kind of template. I searched the web looking for answers. I am wondering if this is a correct practice/method. If it is, does this template have an specific name? They are calling it use case template, I do think is wrong to call it that way.  This is an example:  Note: This template has a valid use case written above of it (not shown in here).  Step:  1  Actor: Application  Action:  Display login page  Login page section has the following fields: - Username - Password - Submit button  Here's the description of the fields for this section: - Username - textbox field, required, no default value, allow 10 character maximum - Password - textbox field, required, no default value, allow alphanumeric characters, allow a maximum of 30 characters    Step:  2  Actor: User  Action: User enters username &amp; password User hits submit button   Step:  3  Actor:  Application  Action:  The app allows access to the page. 	TRUE
40077592	Symfony routing stopped working when not in requirements list	When I first set the project up (in 3.1.4), I set up for the default route a list of default values for the variable to be sent in (locationId) and another route to catch anything that was not in the list and route it to a default value. This stopped working when I tested it again recently, so I set up a new default symfony project and just modified the DefaultController to (this is in 3.1.5):  &lt;?php  namespace AppBundle\Controller;  use Sensio\Bundle\FrameworkExtraBundle\Configuration\Route; use Symfony\Bundle\FrameworkBundle\Controller\Controller; use Symfony\Component\HttpFoundation\Request; use Symfony\Component\HttpFoundation\Response;  class DefaultController extends Controller {     /**      * @Route('/{locationId}', name='homepage', requirements={'locationId': 'L|CH|GCB'})      */     public function indexAction($locationId = 'L')     {         echo $locationId;          return new response('&lt;br&gt;blah');     }      /*      * NOTE: This route is just used for any values that are not matched so they go to L      * @Route('/{locationId}')      */     public function nocampAction($locationId)     {         return $this-&gt;indexAction();     } }   This SHOULD mean that if /path/to/app_dev.php/L is called, it would then echo L and blah. If L is replaced with CH or GCB it should echo them. However, if a value is sent through that is none of these it should default to L. But when I try /path/toapp_dev.php/LLL I get the route can't be found message!  Any idea why this is happening? It never triggers the second route.  NOTE: This test DOES work (old project I cut the code out of so 3.1.4):  &lt;?php  namespace AppBundle\Controller;  use Sensio\Bundle\FrameworkExtraBundle\Configuration\Route; use Symfony\Bundle\FrameworkBundle\Controller\Controller; use Symfony\Component\HttpFoundation\Request; use Symfony\Component\HttpFoundation\Response;  class DefaultController extends Controller {     /**      * @Route('/{varname}', name='homepage', requirements={'varname': '1|2|3'})      */     public function indexAction($varname = 'Cool')     {         echo $varname;         return new Response('&lt;br&gt;default');     }      /**      * NOTE: blah      * @Route('/{varname}')      */     public function novarAction()     {         return $this-&gt;indexAction();     }      /**      * @Route('/test/{varname}')      */     public function testAction()     {         echo 'testAction';         return new Response('OK');     } }  	
39893435	PHPUnit - Can I run tests for a lower version of PHP?	As explained here I can run a test for if the PHP version is at least 5.3.0.  But if I want to run tests for a PHP version lower then 5.3.0?  I write this:  &lt;file phpVersion='5.3.0' phpVersionOperator='&lt;='&gt;./tests/unit/test-file.php&lt;/file&gt;   But I receive this error  Unescaped '&lt;' not allowed in attributes values   How could I do it? 	
39385944	How to judge an issue does not contain child issues in PHP API for Redmine?	Recently, I am working on a project using PHP API for Redmine. Now I need to record whether an issue has any child issues. I have tried to search for related information but failed, so I come here for help. 	
708939	UI Driven Development	Does the idea of UI Driven Development make sense at all? Most of our clients like to convey their requirements in form of screens. For e.g. I want a screen to do THIS and THAT. Sometimes they even go as far as to dictate the layout of a screen by themselves (this may be because clients of today use software applications for most of their tasks already).  Also this method of requirement gathering seems to convey both the Data and Associated Behavior automatically.  What do you guys think? 	TRUE
39102364	How to properly model system requirements in UML (Sparx Enterprise Architect)	I have a list of system requirements that I have imported from IBM Rational DOORS, and I am curious as to what would be a good way to model their relationships with each other in a diagram. Which Structural diagram should I use, or should it be one of the Behavioral ones?    What I've currently created are links to the requirements in an Object diagram, but I would like to make these Child diagrams that I can link to Class diagrams as well. Does this mean that in order to not create a unique diagram for every class element it's linked to, it should be a composite diagrams the requirements are linked to? 	TRUE
38937648	What power supply for servo?	This might be a stupid question although I tried to search everywhere and the answer is kinda of fuzzy. I am trying to power a MG996R High Torque Metal Gear Dual Ball Bearing Servo (manual and description below). This is attached to an arm (wooden) that should with right friction spin a dish (Monitor holder). This is all powered by the arduino. The problem is that the specific voltage as in the manual says is 6v(current 500mA to 900 mA) but the operating voltage is 4.2V a 7.2V exactly how written and it's confusing.  I am planning on hooking it up to a Arduino UNO R3 ATmega 328. I though about buying a hook up of 4 AA batteries 1.5V and make up to 6V to power the servo but I don't know if it will be powering it for much. The other option is to buy a 7.2V power supply or a LiPo to power it but so confusing. Here is a link to the manual from the manufacturer:  Manual  Thank you all! 	
18401861	Upstream and Downstream definition	in my organization they tend to use a nomenclature of 'downstream' and 'upstream' when they talk about communications between systems. What is the definition of these concepts? Is this standard concepts in the world of IT-development? 	
38567138	How to define program&#39;s requirements	Is there any easy, cheap (which don't require to test program on many hardware configuration) and painless method to define hardware requirements (like CPU, RAM memory etc), that are require to run my own program? How it's should be done?  I have quite resource-hungry program written in Java and i don't know how to define hardware specification that will be enough to run this aplication smoothly. 	
38550656	Minimal requirements for Apache and MySQL for Symfony 2.8	Symfony 2.8 requires PHP version to be at least 5.3.9, however nothing is mentioned regarding Apache and MySQL versions in the documentation. What are the minimal requirements for them? 	
38550610	Minimal requirements for Apache and MySQL for Laravel 5.0	What are the minimal requirements for Apache and MySQL for Laravel 5.0?   I have been able to find out the requirement for PHP version, which is   PHP >= 5.4, PHP &lt; 7  But I couldn't find the requirements for Apache and MySQL. Please help! 	
38315428	Buildozer spec file not allowing me to use python re library	  In the Buildozer spec file under requirements i have to list all library's my program needs. I keep getting the same error when I list the re library. Can somebody please help?  requirements = kivy,requests,openssl,re  	
37982985	Does PHP have any hardware or system requirements?	I've been told by the sysadmin that its impossible to update the php version on the webservers in my workplace because they are 'old'.  Is this true?  Does PHP has any hardware or system requirements?   Thanks 	
36467992	NPM peer requirements error	Apologies if this is a dumb question - I'm a complete Meteor Noob...  I'm building an app using meteor 1.3.1 and the Socially tutorial as a reference as it does something very similar to what I need, but I keep seeing the same error in my console and just can't figure it out.  I've installed the accounts.ui package:  meteor add dotansimha:accounts-ui-angular   then added that package as a dependency in my angular module:  angular.module('dkfitness', [ 'angular-meteor', 'ui.router', 'angularMoment', 'accounts.ui' ]);   I have angular installed, .meteor/versions lists:     angular@1.3.9_2   but I keep seeing the following error:  check-npm-versions.js:17 Error: Cannot find module 'angular/package.json'(…) check-npm-versions.js:48 WARNING: npm peer requirements not installed:- angular@^1.2.27 not installed.   I've tried to force the package version of angular to 1.2.27  I've also run:  meteor npm install --save angular   Neither fixes the issue. Can anyone tell me what I am doing wrong? 	
37809079	Implementation and change request tab in requirement work item	In TFS 2010 a requirement work item had also an implementation and a change request tab.    In TFS 2012 the requirement work item also had an implementation and change request tab as written in the documentation, but the picture of a newly created requirement doesn't show anymore these tabs.  Now, in TFS 2015 those two tabse aren't mentioned any more, though the CMMI process shows the work item hierachy as  Epic > Feature > Requirement > Task  I am missing the implementation and change request tab in the standard configuration the CMMI project, because they are very useful in tracking the whole work from defining the features down to the requirements and their implementation with testing as well as subsequent change requests.  Are there any ways to get back these tabs in the standard configuration? I don't like to change the predefined work item types, because you never now what happens with next upgrades of TFS. 	
